nazev,role,typ_firmy,region,situace,proc_nestacil_nabor,co_jsme_udelali,vysledek,zverejnit
"Uchazeči, kteří na trhu působili jako nedostupní",Technické role pro datové centrum a havarijní zásahy,Systémový integrátor,Praha,"Specializované technické role v úzkém oboru, kde běžné cesty nepřinášejí dost relevantních uchazečů.","V referenci zaznívá, že někteří uchazeči působili jako lidé, kteří na trhu fakticky neexistují.","Sintera vedla cílený search podle konkrétních potřeb firmy, odbornosti i rozpočtu.",Během velmi krátké doby přišlo velké množství kvalitních uchazečů.,ano
Přesnost místo objemu: 99 % kandidátů na pohovor,Manažeři a inženýři kvality,Výrobce bezpečnostních systémů pro automobily,Česká republika,U kvalitářských rolí nedává smysl ztrácet čas tříděním nerelevantních životopisů.,"U těchto rolí rozhoduje přesné cílení. Objem CV nepomáhá, pokud kandidáti nesplňují požadavky.","Sintera podle reference posílá kandidáty, kteří splňují požadavky role.",Na pohovor míří 99 % nabídnutých kandidátů a většina pozic se obsazuje přes Sinteru.,ano
Specifické pozice za krátkou dobu,Manažerské a specializované pozice,"Letecký, obranný a kosmický průmysl",Česká republika,Náročné a specifické role v úzce regulovaném oboru.,Trh kandidátů se specifickou kvalifikací je omezený a kandidáti často nepřicházejí sami.,Sintera dodává v krátké době dostatek kandidátů i na specifické pozice a předává k nim potřebné informace.,Spolupráce trvá několik let a kandidáti mají přehled o pozici i firmě.,ano
Mezinárodní manažer před plánovaným termínem,Country Manager India a strategické manažerské role,Výrobce zdravotnických pomůcek,Středočeský kraj,"Náročné mezinárodní role, u kterých dříve vznikaly potíže s obsazením.",Reference přímo uvádí dřívější potíže s obsazením těchto pozic.,"Konzultanti přesně identifikovali firmy, kde se vhodný kandidát mohl nacházet.",Pozice se podařila obsadit před plánovaným termínem.,ano
"Role, kde rozhodlo správně přeložené zadání","Specialista údržby forem, vývojový konstruktér",Automotive a automatizace,Česká republika,Velmi specifické technické pozice mohou brzdit nejasnosti v zadání.,Úzce specializovaný profil běžný inzerát často nepřinese. Navíc stačí nepřesný brief a proces se zpomalí.,"Sintera strukturuje zadání, doptává se a převádí profil do konkrétního search postupu.","Výběr skončil dřív, než se původně čekalo, a další pozice se obsadily v krátké době.",ano
"Pozice, kterou trh dlouho nenabídl",Textilní specialista,Výrobce viskózových a technických vláken,Lovosicko,Pozice se hledala delší dobu a nedařilo se ji obsadit.,Reference uvádí dlouhé předchozí hledání. Standardní cesty kandidáta nepřinesly.,Sintera vedla cílené vyhledávání a držela pravidelný reporting.,Pozice se obsadila ve velmi krátkém čase a spolupráce se rozšířila na další role.,ano
Dlouhodobé partnerství napříč obory,Manažerské pozice a odborní specialisté,"Certifikace, zkušebnictví a automotive",Praha a další regiony,Opakované obsazování seniorních a specializovaných rolí v náročných oborech.,"Úzká odbornost vyžaduje znalost firmy, oboru i trhu kandidátů.",Sintera drží stabilní tým konzultantů a dlouhodobě si udržuje znalost firmy.,"Reference potvrzují dlouhodobou spolupráci, přesnost profilů a obsazené seniorní pozice.",ano
Search řízený detailním briefem,Inženýři kvality a technické role,Automotive,Středočeský kraj,"Hledaný profil musí odpovídat skutečné práci a týmu, ne jen názvu pozice.",Bez detailního pochopení role hrozí špatné cílení a zbytečná kolečka nerelevantních kandidátů.,"Konzultanti se doptávají na obsah práce, tým i změny zadání a podle toho upravují search.",Lepší vytipování uchazečů a pružná reakce při změně profilu za pochodu.,ano
